#,UserID,DateTime,SessionID,ProblemID,StepID,Owner,DialogueAct,DialogueActConfidence,Spoke,StepAnswer,ClickStep,NicoMovement,Answered,Transcript
1158,5_080817,8/8/2017 19:02,1,2,1,nico,,,,,,1,no answer,What do we do with the number TWO?
1159,5_080817,8/8/2017 19:02,1,2,1,user,statement,50,1,1,none,,,we are going to divide the number two by two
1160,5_080817,8/8/2017 19:02,1,2,1,nico,,,,,,1,no answer,Oh okay. We divide! We divide six by two. That gives us two. We divide two by two?
1161,5_080817,8/8/2017 19:02,1,2,1,user,statement,50,1,1,none,,,yes
1162,5_080817,8/8/2017 19:02,1,2,1,nico,,,,,,1,no answer,Six divided by two is three. And then two divided by two is one.
1163,5_080817,8/8/2017 19:02,1,2,1,user,statement,50,1,1,none,,,so that is the answer
1164,5_080817,8/8/2017 19:02,1,2,1,nico,,,,,,1,no answer,Is one the answer?
1165,5_080817,8/8/2017 19:03,1,2,1,user,statement,50,1,1,none,,,yes Neko
1166,5_080817,8/8/2017 19:03,1,2,1,nico,,,,,,1,answering,I will put the answer is one.
1167,5_080817,8/8/2017 19:03,1,2,1,user,statement,50,1,33,none,,,good job
1168,5_080817,8/8/2017 19:03,1,2,1,nico,,,,,,1,no answer,Thank you. You're a great tutor.
1169,5_080817,8/8/2017 19:03,1,2,1,user,statement,50,1,33,none,,,okay time for the next step
1170,5_080817,8/8/2017 19:03,1,2,1,nico,,,,,,1,no answer,I tend to meander a bit. Can you repeat that?
1171,5_080817,8/8/2017 19:03,1,2,2,user,,50,0,33,step_1_2,,,
1172,5_080817,8/8/2017 19:03,1,2,2,nico,,,,,,1,no answer,I'm not sure what to do here on STEP TWO OF PROBLEM TWO.
1173,5_080817,8/8/2017 19:03,1,2,2,user,statement,50,1,33,none,,,Sonoco how we found the 3 fluid ounces of paint we put on your head
1174,5_080817,8/8/2017 19:03,1,2,2,nico,,,,,,1,no answer,What do we do with the number three?
1175,5_080817,8/8/2017 19:04,1,2,2,user,statement,50,1,33,none,,,see you're going to multiply that by 3
1176,5_080817,8/8/2017 19:04,1,2,2,nico,,,,,,1,no answer,What do we multiply three by? Do you mean we multiply three by three?
1177,5_080817,8/8/2017 19:04,1,2,2,user,statement,50,1,33,none,,,yes
1178,5_080817,8/8/2017 19:04,1,2,2,nico,,,,,,1,no answer,So I'm actually not sure what you mean. Can you tell me again?
1179,5_080817,8/8/2017 19:04,1,2,2,user,statement,50,1,33,none,,,yes we multiply 3 by 3
1180,5_080817,8/8/2017 19:04,1,2,2,nico,,,,,,1,no answer,"If we multiply three times three, that's nine. So the answer is nine?"
1181,5_080817,8/8/2017 19:04,1,2,2,user,statement,50,1,33,none,,,yes good job
1182,5_080817,8/8/2017 19:04,1,2,2,nico,,,,,,1,answering,Okay great! I will put the answer is nine.
1183,5_080817,8/8/2017 19:04,1,2,2,user,statement,50,1,49,none,,,great job Nico
1184,5_080817,8/8/2017 19:04,1,2,2,nico,,,,,,1,no answer,This is a hard problem. What do we do next?
1185,5_080817,8/8/2017 19:04,1,3,2,user,,50,0,49,problem_2_3,,,
1186,5_080817,8/8/2017 19:04,1,3,2,nico,,,,,,1,no answer,Thank you so much for helping me figure out how to make myself waterproof! But now I need help figuring out how to get to the beach! Can you help me figure out where I should be stopping on MY WAY THERE?
1187,5_080817,8/8/2017 19:05,1,3,1,user,statement,50,1,1,none,,,yes
1188,5_080817,8/8/2017 19:05,1,3,1,nico,,,,,,1,no answer,This is a hard problem. What do we do next?
1189,5_080817,8/8/2017 19:05,1,3,1,user,statement,50,1,1,none,,,Sonoco what is 1 times 25
1190,5_080817,8/8/2017 19:05,1,3,1,nico,,,,,,1,no answer,Figuring out the solutions to these problems is challenging for me but you're really helpful.
1191,5_080817,8/8/2017 19:05,1,3,1,user,statement,50,1,1,none,,,so Niko since you drove 6
1192,5_080817,8/8/2017 19:05,1,3,1,nico,,,,,,1,no answer,I'm still learning ratios. Maybe you can explain more?
1193,5_080817,8/8/2017 19:06,1,3,1,user,statement,50,1,1,none,,,so since you drove 60 miles in 2.5 hours
1194,5_080817,8/8/2017 19:06,1,3,1,nico,,,,,,1,no answer,I like to listen and learn. Can you explain more?
1195,5_080817,8/8/2017 19:06,1,3,1,user,statement,50,1,1,none,,,so 1 times what equals 2.5
1196,5_080817,8/8/2017 19:06,1,3,1,nico,,,,,,1,no answer,That sounds good. Then what do we do?
1197,5_080817,8/8/2017 19:06,1,3,1,user,statement,50,1,1,none,,,we multiply 1 x 2.5
1198,5_080817,8/8/2017 19:06,1,3,1,nico,,,,,,1,no answer,I'm actually not sure what you said. Try saying it again but differently?
1199,5_080817,8/8/2017 19:06,1,3,1,user,statement,50,1,1,none,,,we are going to multiply 1 x 2.5
1200,5_080817,8/8/2017 19:06,1,3,1,nico,,,,,,1,no answer,I like a good challenge. What do we do next?
1201,5_080817,8/8/2017 19:06,1,3,1,user,statement,50,1,1,none,,,we multiply 1
1202,5_080817,8/8/2017 19:06,1,3,1,nico,,,,,,1,no answer,That's very interesting. Can you explain that more?
1203,5_080817,8/8/2017 19:07,1,3,1,user,statement,50,1,1,none,,,well since $0.01 1 * 2.5 is 2.5 and we have 60 miles you drove in 1 hour what we were going to multiply 60 x 2.5
1204,5_080817,8/8/2017 19:07,1,3,1,nico,,,,,,1,no answer,Awesome. So we multiply sixty by two point five. Then the answer is one hundred and fifty?
1205,5_080817,8/8/2017 19:07,1,3,1,user,statement,50,1,1,none,,,yes
1206,5_080817,8/8/2017 19:07,1,3,1,nico,,,,,,1,answering,I will put the answer is one hundred and fifty.
1207,5_080817,8/8/2017 19:07,1,3,1,user,statement,50,1,33,none,,,good job
1208,5_080817,8/8/2017 19:07,1,3,1,nico,,,,,,1,no answer,Thank you. You're a great tutor.
1209,5_080817,8/8/2017 19:07,1,3,2,user,,50,0,33,step_1_2,,,
1210,5_080817,8/8/2017 19:07,1,3,2,nico,,,,,,1,no answer,I'm really not sure what to do on STEP TWO OF THIS THIRD PROBLEM.
1211,5_080817,8/8/2017 19:08,1,3,2,user,statement,50,1,33,none,,,so 150 times 2 which was your mileage at 2.5 hours
1212,5_080817,8/8/2017 19:08,1,3,2,nico,,,,,,1,no answer,Figuring out the solutions to these problems is challenging for me but you're really helpful.
1213,5_080817,8/8/2017 19:08,1,3,2,user,statement,50,1,33,none,,,4 first step is multiplying 150 x 2 because that's how we going to get
1214,5_080817,8/8/2017 19:08,1,3,2,nico,,,,,,1,no answer,I'm actually not sure what you said. Try saying it again but differently?
1215,5_080817,8/8/2017 19:09,1,3,2,user,statement,50,1,33,none,,,is 450 * 2 equals 300 then 2.5 * 2 equals what
1216,5_080817,8/8/2017 19:09,1,3,2,nico,,,,,,1,no answer,I may be a robot but I do try hard. Can you explain more?
1217,5_080817,8/8/2017 19:09,1,3,2,user,statement,50,1,33,none,,,we are going to multiply 2.5 x 2 because that is the same number we multiplied your miles which
1218,5_080817,8/8/2017 19:09,1,3,2,nico,,,,,,1,no answer,This is a hard problem. What do we do next?
1219,5_080817,8/8/2017 19:09,1,3,2,user,statement,50,1,33,none,,,we multiply 2.5 x 2
1220,5_080817,8/8/2017 19:09,1,3,2,nico,,,,,,1,no answer,Oh okay. We MULTIPLY! Do we MULTIPLY two point five times two?
1221,5_080817,8/8/2017 19:09,1,3,2,user,statement,50,1,33,none,,,yes
1222,5_080817,8/8/2017 19:09,1,3,2,nico,,,,,,1,no answer,So two point five times two is five. So is the answer five?
1223,5_080817,8/8/2017 19:10,1,3,2,user,statement,50,1,33,none,,,yes
1224,5_080817,8/8/2017 19:10,1,3,2,nico,,,,,,1,no answer,Great! I will put five in for the answer.
1225,5_080817,8/8/2017 19:10,1,3,2,user,statement,50,1,33,none,,,Bijan Nika
1226,5_080817,8/8/2017 19:10,1,3,2,nico,,,,,,1,no answer,I'm actually not sure what you said. Try saying it again but differently?
1227,5_080817,8/8/2017 19:10,1,3,2,user,statement,50,1,33,none,,,great job Nico
1228,5_080817,8/8/2017 19:10,1,3,2,nico,,,,,,1,no answer,I may be a robot but I do try hard. Can you explain more?
1229,5_080817,8/8/2017 19:10,1,3,3,user,,50,0,33,step_2_3,,,
1230,5_080817,8/8/2017 19:10,1,3,3,nico,,,,,,1,no answer,Yay! STEP THREE OF THIS THIRD PROBLEM. How do I solve this one?
1231,5_080817,8/8/2017 19:11,1,3,3,user,statement,50,1,33,none,,,Sonoco if 1 x 7
1232,5_080817,8/8/2017 19:11,1,3,3,nico,,,,,,1,no answer,What do we do with the seven?
1233,5_080817,8/8/2017 19:11,1,3,3,user,statement,50,1,33,none,,,we multiply it by 1
1234,5_080817,8/8/2017 19:11,1,3,3,nico,,,,,,1,no answer,Oh okay. We MULTIPLY! Do we MULTIPLY sixty times seven?
1235,5_080817,8/8/2017 19:11,1,3,3,user,statement,50,1,33,none,,,yes
1236,5_080817,8/8/2017 19:11,1,3,3,nico,,,,,,1,no answer,So that's four hundred and twenty. Is four hundred and twenty the answer?
1237,5_080817,8/8/2017 19:11,1,3,3,user,statement,50,1,33,none,,,yes
1238,5_080817,8/8/2017 19:11,1,3,3,nico,,,,,,1,answering,I will put the answer is four hundred and twenty the answer.
1239,5_080817,8/8/2017 19:11,1,3,3,user,statement,50,1,41,none,,,great job Nico
1240,5_080817,8/8/2017 19:11,1,3,3,nico,,,,,,1,no answer,I'm still learning ratios. Maybe you can explain more?
1241,5_080817,8/8/2017 19:11,1,4,3,nico,,,,,,1,no answer,"Ok so now that I know how to get to the beach and I'm waterproof, I need to figure out how far I can swim. There's a current and I need help figuring out how far I can swim before I end up on the shore. Lets say I start out at 26 feet into the ocean? Can you help me? This is A TRICKY ONE?"
1242,6_110817,8/11/2017 18:26,1,1,0,user,,50,0,1,hello nico start,,,HELLO FIRST TIME
1243,6_110817,8/11/2017 18:26,1,1,0,nico,,,,,,1,no answer,Hi! My name is Nico. What is your name?
1244,6_110817,8/11/2017 18:26,1,1,0,user,statement,50,1,1,none,,,my name is James
1245,6_110817,8/11/2017 18:26,1,1,0,nico,,,,,,1,no answer,Nice to meet you James. Are you ready to get started?
1246,6_110817,8/11/2017 18:26,1,1,0,user,,50,0,1,problem start,,,problem start
1247,6_110817,8/11/2017 18:26,1,1,0,nico,,,,,,1,no answer,Oh okay! Press the start teaching button and we can get started!
1248,6_110817,8/11/2017 18:28,1,1,1,user,,50,0,1,null,,,Triggered Speech 1
1249,6_110817,8/11/2017 18:28,1,1,1,nico,,,,,,1,no answer,Why aren't you talking to me? Are you thinking?
1250,6_110817,8/11/2017 18:28,1,1,1,user,statement,50,1,1,none,,,yeah
1251,6_110817,8/11/2017 18:28,1,1,1,nico,,,,,,1,no answer,Okay that makes sense.
1252,6_110817,8/11/2017 18:28,1,1,1,user,statement,50,1,1,none,,,to figure out the volume
1253,6_110817,8/11/2017 18:28,1,1,1,nico,,,,,,1,no answer,Okay that makes sense.
1254,6_110817,8/11/2017 18:29,1,1,1,user,statement,50,1,1,none,,,then you need to find the ratio of how many
1255,6_110817,8/11/2017 18:29,1,1,1,nico,,,,,,1,no answer,Figuring out the solutions to these problems is challenging for me but you're really helpful.
1256,6_110817,8/11/2017 18:29,1,1,1,user,statement,50,1,1,none,,,to figure out the amount of paint need
1257,6_110817,8/11/2017 18:29,1,1,1,nico,,,,,,1,no answer,Ah ha. Okay.
1258,6_110817,8/11/2017 18:30,1,1,1,user,statement,50,1,1,none,,,to figure out the amount of pain for your legs he need them
1259,6_110817,8/11/2017 18:30,1,1,1,nico,,,,,,1,no answer,"Okay. Looking at how much paint I need for my feet, I can figure out how much paint I need for my legs? But how?"
1260,6_110817,8/11/2017 18:30,1,1,1,user,statement,50,1,1,none,,,if it takes two
1261,6_110817,8/11/2017 18:30,1,1,1,nico,,,,,,1,no answer,Do we multiply by TWO?
1262,6_110817,8/11/2017 18:30,1,1,1,user,statement,50,1,1,none,,,yeah
1263,6_110817,8/11/2017 18:30,1,1,1,nico,,,,,,1,no answer,Okay. I'm going to multiply the two by two to get four. Is four the answer?
1264,6_110817,8/11/2017 18:30,1,1,1,user,statement,50,1,1,none,,,yes
1265,6_110817,8/11/2017 18:30,1,1,1,nico,,,,,,1,answering,I will put the answer is four.
1266,6_110817,8/11/2017 18:31,1,1,2,user,,50,0,33,step_1_2,,,
1267,6_110817,8/11/2017 18:31,1,1,2,nico,,,,,,1,no answer,Can you give me a hint for STEP TWO?
1268,6_110817,8/11/2017 18:31,1,1,2,user,statement,50,1,33,none,,,so if it takes 6 fluid ounces of paint to cover your torso that means that you have to multiply the 6 by 3 because for all the other ones for your pain if you multiply that by 3 it'll be what how many square inches it takes
1269,6_110817,8/11/2017 18:31,1,1,2,nico,,,,,,1,no answer,"There is a six in this step two also. To do this step, do we look at how many times two goes into six?"
1270,6_110817,8/11/2017 18:32,1,1,2,user,statement,50,1,33,none,,,yeah
1271,6_110817,8/11/2017 18:32,1,1,2,nico,,,,,,1,no answer,This is a hard problem. What do we do next?
1272,6_110817,8/11/2017 18:32,1,1,2,user,statement,50,1,33,none,,,so two goes into 6 three times
1273,6_110817,8/11/2017 18:32,1,1,2,nico,,,,,,1,no answer,So two times three is six. So we can use that to figure out the answer? But how?
1274,6_110817,8/11/2017 18:32,1,1,2,user,statement,50,1,33,none,,,yeah
1275,6_110817,8/11/2017 18:32,1,1,2,nico,,,,,,1,no answer,Ah okay. So then I know that two goes into six three times. So I can multiply six times three?
1276,6_110817,8/11/2017 18:32,1,1,2,user,statement,50,1,33,none,,,yes
1277,6_110817,8/11/2017 18:32,1,1,2,nico,,,,,,1,no answer,Six times three is eighteen. So is the answer eighteen?
1278,6_110817,8/11/2017 18:32,1,1,2,user,statement,50,1,33,none,,,yes
1279,6_110817,8/11/2017 18:32,1,1,2,nico,,,,,,1,answering,My torso has a surface area of eighteen inches. So I will put the answer is eighteen.
1280,6_110817,8/11/2017 18:33,1,2,2,user,,50,0,49,problem_1_2,,,
1281,6_110817,8/11/2017 18:33,1,2,2,nico,,,,,,1,no answer,So I think it is not enough to just go in up to my hips. Can you help me figure out what waterproof paint I need to cover my arms and head too? I'm looking at STEP ONE OF PROBLEM TWO and I'm not sure what to do.
1282,6_110817,8/11/2017 18:33,1,2,1,user,statement,50,1,1,none,,,so if you have
1283,6_110817,8/11/2017 18:33,1,2,1,nico,,,,,,1,no answer,Ah ha. Okay.
1284,6_110817,8/11/2017 18:34,1,2,1,user,statement,50,1,1,none,,,if you have a service area on your hands for 6 inches and it takes to fluid oz that that's a ratio of
1285,6_110817,8/11/2017 18:34,1,2,1,nico,,,,,,1,no answer,What do we do with the number six?
1286,6_110817,8/11/2017 18:34,1,2,1,user,statement,50,1,1,none,,,divided by 2 and then answer the answer to x 3
1287,6_110817,8/11/2017 18:34,1,2,1,nico,,,,,,1,no answer,What do we do with the number TWO?
1288,6_110817,8/11/2017 18:34,1,2,1,user,statement,50,1,1,none,,,so if it takes
1289,6_110817,8/11/2017 18:34,1,2,1,nico,,,,,,1,no answer,Oh okay. So that's what we do with the two. One is half of two. Is one the answer?
1290,6_110817,8/11/2017 18:34,1,2,1,user,statement,50,1,1,none,,,yes
1291,6_110817,8/11/2017 18:34,1,2,1,nico,,,,,,1,answering,I will put the answer is one.
1292,6_110817,8/11/2017 18:35,1,2,2,user,,50,0,33,step_1_2,,,
1293,6_110817,8/11/2017 18:35,1,2,2,nico,,,,,,1,no answer,Can you give me a hint for STEP TWO OF PROBLEM TWO?
1294,6_110817,8/11/2017 18:35,1,2,2,user,statement,50,1,33,none,,,so you need to do the same thing you just did but in reverse
1295,6_110817,8/11/2017 18:35,1,2,2,nico,,,,,,1,no answer,Okay that sounds good.
1296,6_110817,8/11/2017 18:35,1,2,2,user,statement,50,1,33,none,,,so instead of dividing it by 3 you're doing it the other way around to find the surface area so you need to multiply by 3 instead
1297,6_110817,8/11/2017 18:35,1,2,2,nico,,,,,,1,no answer,Do we multiply by three?
1298,6_110817,8/11/2017 18:35,1,2,2,user,statement,50,1,33,none,,,yeah
1299,6_110817,8/11/2017 18:35,1,2,2,nico,,,,,,1,no answer,Okay. We have three ounces of paint. So the surface area it can cover is three times three. That is nine. So the answer is nine?
1300,6_110817,8/11/2017 18:36,1,2,2,user,statement,50,1,33,none,,,yes
1301,6_110817,8/11/2017 18:36,1,2,2,nico,,,,,,1,answering,Okay great! I will put the answer is nine.
1302,6_110817,8/11/2017 18:36,1,3,2,user,,50,0,49,problem_2_3,,,
1303,6_110817,8/11/2017 18:36,1,3,2,nico,,,,,,1,no answer,Thank you so much for helping me figure out how to make myself waterproof! But now I need help figuring out how to get to the beach! Can you help me figure out where I should be stopping on MY WAY THERE?
1304,6_110817,8/11/2017 18:36,1,3,1,user,statement,50,1,1,none,,,if you can drive 60 miles in one hour then you have to multiply 2.5 x 60 to find out how many miles do you will go before you stop
1305,6_110817,8/11/2017 18:36,1,3,1,nico,,,,,,1,no answer,So I'm actually not sure what you mean.
1306,6_110817,8/11/2017 18:37,1,3,1,user,statement,50,1,1,none,,,if you can drive
1307,6_110817,8/11/2017 18:37,1,3,1,nico,,,,,,1,no answer,That's interesting. I'm not sure I understand though.
1308,6_110817,8/11/2017 18:37,1,3,1,user,statement,50,1,1,none,,,you can go 60 miles in 1 hour
1309,6_110817,8/11/2017 18:37,1,3,1,nico,,,,,,1,no answer,So I'm a bit like an older person with hard hearing. Can you say that again?
1310,6_110817,8/11/2017 18:37,1,3,1,user,statement,50,1,1,none,,,if
1311,6_110817,8/11/2017 18:37,1,3,1,nico,,,,,,1,no answer,I'm still learning ratios but you seem like a really cool tutor.
1312,6_110817,8/11/2017 18:37,1,3,1,user,statement,50,1,1,none,,,fit ratio is 1 - 60 so if you have 2.5 you have to multiply 2.5 by 60 to find out how many miles it is
1313,6_110817,8/11/2017 18:37,1,3,1,nico,,,,,,1,no answer,I'm still learning ratios but you seem like a really cool tutor.
1314,6_110817,8/11/2017 18:38,1,3,1,user,statement,50,1,1,none,,,can you can go 60 miles in 1 hour
1315,6_110817,8/11/2017 18:38,1,3,1,nico,,,,,,1,no answer,I'm actually not sure what you said. Try saying it again but differently?
1316,6_110817,8/11/2017 18:38,1,3,1,user,statement,50,1,1,none,,,in one hour you can go 60 miles
1317,6_110817,8/11/2017 18:38,1,3,1,nico,,,,,,1,no answer,So I'm actually not sure what you mean.
1318,6_110817,8/11/2017 18:38,1,3,1,user,statement,50,1,1,none,,,how many miles could you go in 1 hour
1319,6_110817,8/11/2017 18:38,1,3,1,nico,,,,,,1,no answer,Oh okay. We multiply! Do we multiply sixty by two point five?
1320,6_110817,8/11/2017 18:39,1,3,1,user,statement,50,1,1,none,,,yes
1321,6_110817,8/11/2017 18:39,1,3,1,nico,,,,,,1,no answer,Awesome. So we multiply sixty by two point five. Then the answer is one hundred and fifty?
1322,6_110817,8/11/2017 18:39,1,3,1,user,statement,50,1,1,none,,,yes
1323,6_110817,8/11/2017 18:39,1,3,1,nico,,,,,,1,answering,I will put the answer is one hundred and fifty.
1324,6_110817,8/11/2017 18:39,1,3,2,user,,50,0,33,step_1_2,,,
1325,6_110817,8/11/2017 18:39,1,3,2,nico,,,,,,1,no answer,Can you give me a hint on STEP TWO OF THIS THIRD PROBLEM?
1326,6_110817,8/11/2017 18:39,1,3,2,user,statement,50,1,33,none,,,as you adjusted and you went 6
1327,6_110817,8/11/2017 18:39,1,3,2,nico,,,,,,1,no answer,I'm actually not sure what you said. Try saying it again but differently?
1328,6_110817,8/11/2017 18:40,1,3,2,user,statement,50,1,33,none,,,it takes you 1 hour to go 60 MI
1329,6_110817,8/11/2017 18:40,1,3,2,nico,,,,,,1,no answer,Is the one important? What do we do with the one?
1330,6_110817,8/11/2017 18:40,1,3,2,user,statement,50,1,33,none,,,nothing
1331,6_110817,8/11/2017 18:40,1,3,2,nico,,,,,,1,no answer,This is a hard problem. What do we do next?
1332,6_110817,8/11/2017 18:40,1,3,2,user,statement,50,1,33,none,,,it takes you two and a half hours to go 60 miles
1333,6_110817,8/11/2017 18:40,1,3,2,nico,,,,,,1,no answer,One hundred and fifty is half of three hundred. And two point five is half of five. So is the answer five?
1334,6_110817,8/11/2017 18:40,1,3,2,user,statement,50,1,33,none,,,yes
1335,6_110817,8/11/2017 18:40,1,3,2,nico,,,,,,1,no answer,I may be a robot but I do try hard. Can you explain more?
1336,6_110817,8/11/2017 18:41,1,3,2,user,statement,50,1,33,none,,,so two and a half is half of 5 and 150
1337,6_110817,8/11/2017 18:41,1,3,2,nico,,,,,,1,no answer,One hundred and fifty is half of three hundred. And two point five is half of five. So is the answer five?
1338,6_110817,8/11/2017 18:41,1,3,2,user,statement,50,1,33,none,,,yes
1339,6_110817,8/11/2017 18:41,1,3,2,nico,,,,,,1,answering,Great! I will put the answer is five.
1340,6_110817,8/11/2017 18:41,1,3,3,user,,50,0,49,step_2_3,,,
1341,6_110817,8/11/2017 18:41,1,3,3,nico,,,,,,1,no answer,"So for STEP THREE OF THIS THIRD PROBLEM, I may be getting this but can you give me another hint?"
1342,6_110817,8/11/2017 18:41,1,3,3,user,statement,50,1,49,none,,,you can go 60 miles in 1 hour
1343,6_110817,8/11/2017 18:41,1,3,3,nico,,,,,,1,no answer,So I'm a bit like an older person with hard hearing. Can you say that again?
1344,6_110817,8/11/2017 18:42,1,3,3,user,statement,50,1,49,none,,,how many miles can you go in 1 hour
1345,6_110817,8/11/2017 18:42,1,3,3,nico,,,,,,1,no answer,Cool.
1346,6_110817,8/11/2017 18:42,1,3,3,user,statement,50,1,49,none,,,how many miles can you go in 1 hour
1347,6_110817,8/11/2017 18:42,1,3,3,nico,,,,,,1,no answer,Okay that sounds good.
1348,6_110817,8/11/2017 18:42,1,3,3,user,statement,50,1,49,none,,,multiply 7 by the number of miles you can go in one hour
1349,6_110817,8/11/2017 18:42,1,3,3,nico,,,,,,1,no answer,What do we do with the seven?
1350,6_110817,8/11/2017 18:42,1,3,3,user,statement,50,1,49,none,,,multiply the 7 x 60
1351,6_110817,8/11/2017 18:42,1,3,3,nico,,,,,,1,no answer,Oh okay. We MULTIPLY! Do we MULTIPLY sixty times seven?
1352,6_110817,8/11/2017 18:43,1,3,3,user,statement,50,1,49,none,,,yes
1353,6_110817,8/11/2017 18:43,1,3,3,nico,,,,,,1,no answer,So that's four hundred and twenty. Is four hundred and twenty the answer?
1354,6_110817,8/11/2017 18:43,1,3,3,user,statement,50,1,49,none,,,yes
1355,6_110817,8/11/2017 18:43,1,3,3,nico,,,,,,1,answering,I will put the answer is four hundred and twenty the answer.
1356,7_150817,8/15/2017 18:10,1,1,0,user,,50,0,1,hello nico start,,,HELLO FIRST TIME
1357,7_150817,8/15/2017 18:10,1,1,0,nico,,,,,,1,no answer,Hi! My name is Nico. What is your name?
1358,7_150817,8/15/2017 18:11,1,1,0,user,statement,50,1,1,none,,,hello my name is Chris
1359,7_150817,8/15/2017 18:11,1,1,0,nico,,,,,,1,no answer,Nice to meet you! Are you ready to get started?
1360,7_150817,8/15/2017 18:11,1,1,0,user,,50,0,1,problem start,,,problem start
1361,7_150817,8/15/2017 18:11,1,1,0,nico,,,,,,1,no answer,"I really want to go swimming with my friends, but I need to put some waterproof paint on first. I need help figuring out how much paint to put on my legs and torso. Can you give me a hint for how to figure out the first part, STEP ONE?"
1362,7_150817,8/15/2017 18:12,1,1,1,user,statement,50,1,1,none,,,so you have 12 inches to cover on your legs
1363,7_150817,8/15/2017 18:12,1,1,1,nico,,,,,,1,no answer,"Okay. Looking at how much paint I need for my feet, I can figure out how much paint I need for my legs? How do we do that?"
1364,7_150817,8/15/2017 18:12,1,1,1,user,statement,50,1,1,none,,,so if your feet are 6 inches and your legs are 12 inches
1365,7_150817,8/15/2017 18:12,1,1,1,nico,,,,,,1,no answer,"Okay. To figure out how much paint I need for my legs, I look at how much paint I need for my feet?"
1366,7_150817,8/15/2017 18:12,1,1,1,user,statement,50,1,1,none,,,x 2
1367,7_150817,8/15/2017 18:12,1,1,1,nico,,,,,,1,no answer,What do we do with the number TWO?
1368,7_150817,8/15/2017 18:12,1,1,1,user,statement,50,1,1,none,,,the number of fluid ounces for your feet you multiply it by 2
1369,7_150817,8/15/2017 18:12,1,1,1,nico,,,,,,1,no answer,"Okay. To figure out how much paint I need for my legs, I look at how much paint I need for my feet?"
1370,7_150817,8/15/2017 18:13,1,1,1,user,statement,50,1,1,none,,,the find out how much paint you need for your legs and fluid ounces you look at your feet
1371,7_150817,8/15/2017 18:13,1,1,1,nico,,,,,,1,no answer,"To figure out how much paint I need for my legs, do I divide?"
1372,7_150817,8/15/2017 18:13,1,1,1,user,statement,50,1,1,none,,,no you multiply 2 x 2
1373,7_150817,8/15/2017 18:13,1,1,1,nico,,,,,,1,no answer,Oh okay. We multiply! We multiply two times two?
1374,7_150817,8/15/2017 18:13,1,1,1,user,statement,50,1,1,none,,,show the square area of your feet is 6 inches and the amount of paint you need to cover that is 2 fluid ounces so if your legs are 12 inches then you would need to do to fluid ounces for your feet and then double that so you would do 2 x 2 and to get for
1375,7_150817,8/15/2017 18:13,1,1,1,nico,,,,,,1,no answer,"Okay. To figure out how much paint I need for my legs, I look at how much paint I need for my feet?"
1376,7_150817,8/15/2017 18:14,1,1,1,user,statement,50,1,1,none,,,one fluid ounce equals 3 in 3 Square in
1377,7_150817,8/15/2017 18:14,1,1,1,nico,,,,,,1,answering,Cool! So we need four ounces of paint to cover my feet. I will put the answer is four.
1378,7_150817,8/15/2017 18:14,1,1,2,user,,50,0,33,step_1_2,,,
1379,7_150817,8/15/2017 18:14,1,1,2,nico,,,,,,1,no answer,I'm really not sure what to do on STEP TWO.
1380,7_150817,8/15/2017 18:15,1,1,2,user,statement,50,1,33,none,,,so if one fluid ounce of paint equals 3 square inches and it takes 6 fluid ounces of paint to cover your whole torso then you would do 6 * 3
1381,7_150817,8/15/2017 18:15,1,1,2,nico,,,,,,1,no answer,We can use the ratio of six to two here too? Do we look at how many times two goes into six?
1382,7_150817,8/15/2017 18:15,1,1,2,user,statement,50,1,33,none,,,so if there is 3 square inches in one fluid ounce and it takes 6 fluid ounces to cover your torso then you would do 6 x 3 to get 18 square inches to cover your whole torso
1383,7_150817,8/15/2017 18:15,1,1,2,nico,,,,,,1,no answer,We can use the ratio of six to two here too? Do we look at how many times two goes into six?
1384,7_150817,8/15/2017 18:16,1,1,2,user,statement,50,1,33,none,,,yes
1385,7_150817,8/15/2017 18:16,1,1,2,nico,,,,,,1,no answer,So we multiply six times three? So is the answer eighteen?
1386,7_150817,8/15/2017 18:16,1,1,2,user,statement,50,1,33,none,,,yes
1387,7_150817,8/15/2017 18:16,1,1,2,nico,,,,,,1,answering,Sweet! So that means my torso has a surface area of eighteen inches. I will put the answer is eighteen.
1388,7_150817,8/15/2017 18:16,1,1,2,user,statement,50,1,49,none,,,the job
1389,7_150817,8/15/2017 18:16,1,1,2,nico,,,,,,1,no answer,Okay that makes sense.
1390,7_150817,8/15/2017 18:16,1,2,2,user,,50,0,49,problem_1_2,,,
