#,UserID,DateTime,SessionID,ProblemID,StepID,Owner,DialogueAct,DialogueActConfidence,Spoke,StepAnswer,ClickStep,NicoMovement,Answered,Transcript
922,4_030817,8/3/2017 17:41,1,3,2,nico,,,,,,1,no answer,Thank you so much for helping me figure out how to make myself waterproof! But now I need help figuring out how to get to the beach! Can you help me figure out where I should be stopping on MY WAY THERE?
923,4_030817,8/3/2017 17:41,1,3,1,user,statement,50,1,1,none,,,what is 1 * 60
924,4_030817,8/3/2017 17:41,1,3,1,nico,,,,,,1,no answer,Okay that makes sense.
925,4_030817,8/3/2017 17:41,1,3,1,user,statement,50,1,1,none,,,this is a multiplication problem
926,4_030817,8/3/2017 17:41,1,3,1,nico,,,,,,1,no answer,Cool.
927,4_030817,8/3/2017 17:42,1,3,1,user,statement,50,1,1,none,,,2.5 x 60
928,4_030817,8/3/2017 17:42,1,3,1,nico,,,,,,1,no answer,This is a hard problem. What do we do next?
929,4_030817,8/3/2017 17:42,1,3,1,user,statement,50,1,1,none,,,multiply
930,4_030817,8/3/2017 17:42,1,3,1,nico,,,,,,1,no answer,I'm actually not sure what you said. Try saying it again but differently?
931,4_030817,8/3/2017 17:42,1,3,1,user,statement,50,1,1,none,,,multiply 2 times 2.5 times 60
932,4_030817,8/3/2017 17:42,1,3,1,nico,,,,,,1,no answer,I may be a robot but I do try hard. Can you explain more?
933,4_030817,8/3/2017 17:43,1,3,1,user,statement,50,1,1,none,,,what's .5 times 2
934,4_030817,8/3/2017 17:43,1,3,1,nico,,,,,,1,no answer,Okay.
935,4_030817,8/3/2017 17:43,1,3,2,user,,50,0,1,step_1_2,,,
936,4_030817,8/3/2017 17:43,1,3,2,nico,,,,,,1,no answer,I'm really not sure what to do on STEP TWO OF THIS THIRD PROBLEM.
937,4_030817,8/3/2017 17:43,1,3,2,user,statement,50,1,1,none,,,it's a division problem
938,4_030817,8/3/2017 17:43,1,3,2,nico,,,,,,1,no answer,Okay that sounds good.
939,4_030817,8/3/2017 17:43,1,3,2,user,statement,50,1,1,none,,,300 divided by 60
940,4_030817,8/3/2017 17:43,1,3,2,nico,,,,,,1,no answer,I'm still learning ratios but you seem like a really cool tutor.
941,4_030817,8/3/2017 17:44,1,3,2,user,statement,50,1,1,none,,,300 divided into 60 parts
942,4_030817,8/3/2017 17:44,1,3,2,nico,,,,,,1,no answer,Oh okay. So is the answer five?
943,4_030817,8/3/2017 17:44,1,3,2,user,statement,50,1,1,none,,,yes
944,4_030817,8/3/2017 17:44,1,3,2,nico,,,,,,1,no answer,Great! I will put five in for the answer.
945,4_030817,8/3/2017 17:45,1,3,2,user,statement,50,1,1,none,,,300 divided by 60 is what
946,4_030817,8/3/2017 17:45,1,3,2,nico,,,,,,1,no answer,Okay that sounds good.
947,4_030817,8/3/2017 17:45,1,3,3,user,,50,0,1,step_2_3,,,
948,4_030817,8/3/2017 17:45,1,3,3,nico,,,,,,1,no answer,"So for STEP THREE OF THIS THIRD PROBLEM, I may be getting this but can you give me another hint?"
949,4_030817,8/3/2017 17:46,1,3,3,user,statement,50,1,1,none,,,it's a multiplication problem
950,4_030817,8/3/2017 17:46,1,3,3,nico,,,,,,1,no answer,Cool.
951,4_030817,8/3/2017 17:46,1,3,3,user,statement,50,1,1,none,,,7 times 60 equals what
952,4_030817,8/3/2017 17:46,1,3,3,nico,,,,,,1,no answer,
953,4_030817,8/3/2017 17:46,1,3,3,user,statement,50,1,1,none,,,760 times as what
954,4_030817,8/3/2017 17:46,1,3,3,nico,,,,,,1,no answer,So I'm a bit like an older person with hard hearing. Can you say that again?
955,4_030817,8/3/2017 17:46,1,3,3,user,statement,50,1,1,none,,,7 times 6 equals
956,4_030817,8/3/2017 17:46,1,3,3,nico,,,,,,1,no answer,What do we do with the seven?
957,4_030817,8/3/2017 17:46,1,3,3,user,statement,50,1,1,none,,,time is it by 6
958,4_030817,8/3/2017 17:46,1,3,3,nico,,,,,,1,no answer,Okay.
959,4_030817,8/3/2017 17:46,1,3,3,user,statement,50,1,1,none,,,times it by 60
960,4_030817,8/3/2017 17:46,1,3,3,nico,,,,,,1,no answer,I may be a robot but I do try hard. Can you explain more?
961,4_030817,8/3/2017 17:47,1,3,3,user,statement,50,1,1,none,,,7 x 60
962,4_030817,8/3/2017 17:47,1,3,3,nico,,,,,,1,no answer,What do we do with the seven?
963,4_030817,8/3/2017 17:47,1,3,3,user,statement,50,1,1,none,,,times it by 60
964,4_030817,8/3/2017 17:47,1,3,3,nico,,,,,,1,no answer,Oh okay. We MULTIPLY! Do we MULTIPLY sixty times seven?
965,4_030817,8/3/2017 17:47,1,3,3,user,statement,50,1,1,none,,,yes
966,4_030817,8/3/2017 17:47,1,3,3,nico,,,,,,1,no answer,So that's four hundred and twenty. Is four hundred and twenty the answer?
967,4_030817,8/3/2017 17:47,1,3,3,user,statement,50,1,1,none,,,yes
968,4_030817,8/3/2017 17:47,1,3,3,nico,,,,,,1,answering,I will put the answer is four hundred and twenty the answer.
969,4_030817,8/3/2017 17:47,1,3,2,user,,50,0,9,step_3_2,,,
970,4_030817,8/3/2017 17:47,1,3,2,nico,,,,,,1,no answer,Okay! BACK TO STEP TWO PROBLEM THREE.
971,4_030817,8/3/2017 17:47,1,3,2,user,statement,50,1,9,none,,,what was the answer for this one again
972,4_030817,8/3/2017 17:47,1,3,2,nico,,,,,,1,no answer,Is five the answer?
973,4_030817,8/3/2017 17:48,1,3,2,user,statement,50,1,9,none,,,yes
974,4_030817,8/3/2017 17:48,1,3,2,nico,,,,,,1,no answer,Cool.
975,4_030817,8/3/2017 17:48,1,3,1,user,,50,0,9,step_2_1,,,
976,4_030817,8/3/2017 17:48,1,3,1,nico,,,,,,1,no answer,Didn't we already do step one for problem THREE?
977,4_030817,8/3/2017 17:48,1,3,1,user,statement,50,1,9,none,,,2.5 x 60
978,4_030817,8/3/2017 17:48,1,3,1,nico,,,,,,1,no answer,Why are we here?
979,4_030817,8/3/2017 17:48,1,3,2,user,,50,0,9,step_1_2,,,
980,4_030817,8/3/2017 17:48,1,3,2,nico,,,,,,1,no answer,Didn't we already do step two for problem THREE?
981,4_030817,8/3/2017 17:48,1,3,3,user,,50,0,9,step_2_3,,,
982,4_030817,8/3/2017 17:48,1,3,3,nico,,,,,,1,no answer,"So for STEP THREE OF THIS THIRD PROBLEM, I may be getting this but can you give me another hint?"
983,4_030817,8/3/2017 18:10,1,1,0,user,,50,0,1,hello nico start,,,HELLO FIRST TIME
984,4_030817,8/3/2017 18:10,1,1,0,nico,,,,,,1,no answer,I will put the answer is four hundred and twenty the answer.
985,4_030817,8/3/2017 18:10,1,1,0,user,statement,50,1,1,none,,,when did put it down hello Nico
986,4_030817,8/3/2017 18:10,1,1,0,nico,,,,,,1,no answer,I'm still learning ratios but you seem like a really cool tutor.
987,4_030817,8/3/2017 18:10,1,1,0,user,,50,0,1,problem start,,,problem start
988,4_030817,8/3/2017 18:10,1,1,0,nico,,,,,,1,no answer,"I really want to go swimming with my friends, but I need to put some waterproof paint on first. I need help figuring out how much paint to put on my legs and torso. Can you give me a hint for how to figure out the first part, STEP ONE?"
989,4_030817,8/3/2017 18:11,1,1,2,user,,50,0,1,step_1_2,,,
990,4_030817,8/3/2017 18:11,1,1,2,nico,,,,,,1,no answer,I'm not sure what to do here on STEP TWO.
991,4_030817,8/3/2017 18:11,1,2,2,user,,50,0,1,problem_1_2,,,
992,4_030817,8/3/2017 18:11,1,2,2,nico,,,,,,1,no answer,So I think it is not enough to just go in up to my hips. Can you help me figure out what waterproof paint I need to cover my arms and head too? I'm looking at STEP ONE OF PROBLEM TWO and I'm not sure what to do.
993,4_030817,8/3/2017 18:11,1,2,1,user,,50,0,1,null,,,Triggered Speech 1
994,4_030817,8/3/2017 18:11,1,2,1,nico,,,,,,1,no answer,Why aren't you talking to me? Are you thinking?
995,4_030817,8/3/2017 18:12,1,2,2,user,,50,0,1,step_1_2,,,
996,4_030817,8/3/2017 18:12,1,2,2,nico,,,,,,1,no answer,I'm not sure what to do here on STEP TWO OF PROBLEM TWO.
997,4_030817,8/3/2017 18:12,1,2,2,user,,50,0,1,null,,,Triggered Speech 2
998,4_030817,8/3/2017 18:12,1,2,2,nico,,,,,,1,no answer,Why aren't you talking to me? I'm getting tired.
999,4_030817,8/3/2017 18:12,1,3,2,user,,50,0,1,problem_2_3,,,
1000,4_030817,8/3/2017 18:12,1,3,2,nico,,,,,,1,no answer,Thank you so much for helping me figure out how to make myself waterproof! But now I need help figuring out how to get to the beach! Can you help me figure out where I should be stopping on MY WAY THERE?
1001,4_030817,8/3/2017 18:12,1,3,2,user,,50,0,1,problem_2_3,,,
1002,4_030817,8/3/2017 18:12,1,3,2,nico,,,,,,1,no answer,Thank you so much for helping me figure out how to make myself waterproof! But now I need help figuring out how to get to the beach! Can you help me figure out where I should be stopping on MY WAY THERE?
1003,4_030817,8/3/2017 18:12,1,3,2,user,,50,0,1,problem_2_3,,,
1004,4_030817,8/3/2017 18:12,1,3,2,nico,,,,,,1,no answer,Thank you so much for helping me figure out how to make myself waterproof! But now I need help figuring out how to get to the beach! Can you help me figure out where I should be stopping on MY WAY THERE?
1005,4_030817,8/3/2017 18:13,1,3,1,user,statement,50,1,1,none,,,hey Nico so what's the answer
1006,4_030817,8/3/2017 18:13,1,3,1,nico,,,,,,1,no answer,Is one hundred and fifty the answer?
1007,4_030817,8/3/2017 18:13,1,3,1,user,,50,0,1,null,,,Triggered Speech 3
1008,4_030817,8/3/2017 18:13,1,3,1,nico,,,,,,1,no answer,"If you aren't going to talk to me, I think I'm going to go to sleep."
1009,4_030817,8/3/2017 18:13,1,3,1,user,statement,50,1,1,none,,,yep 150 is the answer
1010,4_030817,8/3/2017 18:13,1,3,1,nico,,,,,,1,no answer,Is one hundred and fifty the answer?
1011,4_030817,8/3/2017 18:13,1,3,1,user,statement,50,1,1,none,,,yes it is I was quite rude
1012,4_030817,8/3/2017 18:13,1,3,1,nico,,,,,,1,answering,I will put the answer is one hundred and fifty .
1013,4_030817,8/3/2017 18:13,1,3,2,user,,50,0,33,step_1_2,,,
1014,4_030817,8/3/2017 18:13,1,3,2,nico,,,,,,1,no answer,I'm not sure what to do here on STEP TWO OF THIS THIRD PROBLEM.
1015,4_030817,8/3/2017 18:13,1,3,2,user,statement,50,1,33,none,,,Nico what's the answer for the step
1016,4_030817,8/3/2017 18:13,1,3,2,nico,,,,,,1,no answer,Is five the answer?
1017,4_030817,8/3/2017 18:14,1,3,2,user,statement,50,1,33,none,,,yes
1018,4_030817,8/3/2017 18:14,1,3,2,nico,,,,,,1,no answer,I'm sorry. I am trying. What do we do?
1019,4_030817,8/3/2017 18:14,1,3,2,user,statement,50,1,33,none,,,yes the answer is 5
1020,4_030817,8/3/2017 18:14,1,3,2,nico,,,,,,1,no answer,Is five the answer?
1021,4_030817,8/3/2017 18:14,1,3,2,user,statement,50,1,33,none,,,yes
1022,4_030817,8/3/2017 18:14,1,3,2,nico,,,,,,1,no answer,So I'm actually not sure what you mean.
1023,4_030817,8/3/2017 18:14,1,3,2,user,statement,50,1,33,none,,,put 5 in for the answer
1024,4_030817,8/3/2017 18:14,1,3,2,nico,,,,,,1,no answer,Is five the answer?
1025,4_030817,8/3/2017 18:14,1,3,2,user,statement,50,1,33,none,,,yes it is put it in
1026,4_030817,8/3/2017 18:14,1,3,2,nico,,,,,,1,no answer,So I'm actually not sure what you mean.
1027,4_030817,8/3/2017 18:14,1,3,3,user,,50,0,33,step_2_3,,,
1028,4_030817,8/3/2017 18:14,1,3,3,nico,,,,,,1,no answer,Wow we're on STEP THREE OF THIS THIRD PROBLEM. How do we do this one?
1029,4_030817,8/3/2017 18:15,1,3,3,user,statement,50,1,33,none,,,how is your day do you like cats do you like dogs
1030,4_030817,8/3/2017 18:15,1,3,3,nico,,,,,,1,no answer,Okay that makes sense.
1031,4_030817,8/3/2017 18:15,1,3,3,user,statement,50,1,33,none,,,Nico what's your favorite color
1032,4_030817,8/3/2017 18:15,1,3,3,nico,,,,,,1,no answer,So I'm actually not sure what you mean.
1033,4_030817,8/3/2017 18:16,1,3,3,user,statement,50,1,33,none,,,Nikka what's your favorite color
1034,4_030817,8/3/2017 18:16,1,3,3,nico,,,,,,1,no answer,Figuring out the solutions to these problems is challenging for me but you're really helpful.
1035,4_030817,8/3/2017 18:16,1,3,3,user,statement,50,1,33,none,,,what's your favorite animal is it a cat is it a dog is it a bird is it a plane
1036,4_030817,8/3/2017 18:16,1,3,3,nico,,,,,,1,no answer,So I'm a bit like an older person with hard hearing. Can you say that again?
1037,5_080817,8/8/2017 18:42,1,1,0,user,,50,0,1,hello nico start,,,HELLO FIRST TIME
1038,5_080817,8/8/2017 18:42,1,1,0,nico,,,,,,1,no answer,Hi! My name is Nico. What is your name?
1039,5_080817,8/8/2017 18:42,1,1,0,user,statement,50,1,1,none,,,Oscar
1040,5_080817,8/8/2017 18:42,1,1,0,nico,,,,,,1,no answer,Nice to meet you! Are you ready to get started?
1041,5_080817,8/8/2017 18:43,1,1,0,user,,50,0,1,problem start,,,problem start
1042,5_080817,8/8/2017 18:43,1,1,0,nico,,,,,,1,no answer,Oh okay! Press the start teaching button and we can get started!
1043,5_080817,8/8/2017 18:44,1,1,1,user,,50,0,1,null,,,Triggered Speech 1
1044,5_080817,8/8/2017 18:44,1,1,1,nico,,,,,,1,no answer,Why aren't you talking to me? Are you thinking?
1045,5_080817,8/8/2017 18:44,1,1,1,user,statement,50,1,1,none,,,so right now we're going to be finding the surface area of your legs
1046,5_080817,8/8/2017 18:44,1,1,1,nico,,,,,,1,no answer,That's very interesting. Can you explain that more?
1047,5_080817,8/8/2017 18:45,1,1,1,user,,50,0,1,null,,,Triggered Speech 1
1048,5_080817,8/8/2017 18:45,1,1,1,nico,,,,,,1,no answer,Why aren't you talking to me? Are you thinking?
1049,5_080817,8/8/2017 18:45,1,1,1,user,statement,50,1,1,none,,,image of so we're going to be finding the surface area to cover up the volume of paint with waterproof case you can go swimming and we need to find out how much volume of pain we need to cover up the surface area with a likes
1050,5_080817,8/8/2017 18:45,1,1,1,nico,,,,,,1,no answer,I tend to meander a bit. Can you repeat that?
1051,5_080817,8/8/2017 18:46,1,1,1,user,statement,50,1,1,none,,,we are going to be finding the surface area of your legs since we already know that we're going to find the volume of paint we need to cover up your legs which are 12 inches
1052,5_080817,8/8/2017 18:46,1,1,1,nico,,,,,,1,no answer,That sounds good. Then what do we do?
1053,5_080817,8/8/2017 18:46,1,1,1,user,statement,50,1,1,none,,,so right now we're going to find out since we covered up your feet which were 6 surface area on which surface area was square inches recovered up volume of paint was 2 fluid ounces
1054,5_080817,8/8/2017 18:46,1,1,1,nico,,,,,,1,no answer,So I'm actually not sure what you mean. Can you tell me again?
1055,5_080817,8/8/2017 18:47,1,1,1,user,statement,50,1,1,none,,,so the volume of paint we used to cover up the the surface area of your feet was 2 fluid ounces and the surface area of your feet or 6 in square inches
1056,5_080817,8/8/2017 18:47,1,1,1,nico,,,,,,1,no answer,I'm actually not sure what you said. Try saying it again but differently?
1057,5_080817,8/8/2017 18:47,1,1,1,user,statement,50,1,1,none,,,solder me finding out the fluid the fluid ounces of the paint which we covered up the 6 squared inches of your feet now we're going to do is multiply 6 * 2 + 2 * what Nico
1058,5_080817,8/8/2017 18:47,1,1,1,nico,,,,,,1,no answer,So I'm actually not sure what you mean. Can you tell me again?
1059,5_080817,8/8/2017 18:48,1,1,1,user,statement,50,1,1,none,,,so we're going to be finding the volume of paint which is fluid ounces we used to to cover up your feet which was 6 squared inches and your legs are 12 square inches so where the volume of paint we're going to be using since 6 inches were doubled with your legs
1060,5_080817,8/8/2017 18:48,1,1,1,nico,,,,,,1,no answer,That sounds good. Then what do we do?
1061,5_080817,8/8/2017 18:48,1,1,1,user,statement,50,1,1,none,,,we need to double up the surface area of your square inches off your feet which were six inches when you had double that up
1062,5_080817,8/8/2017 18:48,1,1,1,nico,,,,,,1,no answer,Figuring out the solutions to these problems is challenging for me but you're really helpful.
1063,5_080817,8/8/2017 18:48,1,1,2,user,,50,0,1,step_1_2,,,
1064,5_080817,8/8/2017 18:48,1,1,2,nico,,,,,,1,no answer,I'm not sure what to do here on STEP TWO.
1065,5_080817,8/8/2017 18:49,1,1,2,user,statement,50,1,1,none,,,since your surface area of was on your legs worth 12 in square or Square
1066,5_080817,8/8/2017 18:49,1,1,2,nico,,,,,,1,no answer,I'm actually not sure what you said. Try saying it again but differently?
1067,5_080817,8/8/2017 18:49,1,1,2,user,statement,50,1,1,none,,,so since your legs were 12 square inches
1068,5_080817,8/8/2017 18:49,1,1,2,nico,,,,,,1,no answer,Figuring out the solutions to these problems is challenging for me but you're really helpful.
1069,5_080817,8/8/2017 18:50,1,1,2,user,statement,50,1,1,none,,,so since your surface area of where 12 of your legs were 12 square inches and the volume of paint will use to paint yourself or six fluid ounces how much do you think the surface area on squared inches will be since we doubled up the 4 fluid ounces on your legs how much you think that how much do you think it will be doubled up at 12 square inches
1070,5_080817,8/8/2017 18:50,1,1,2,nico,,,,,,1,no answer,There is a six in this step two. What do we do with the number six here?
1071,5_080817,8/8/2017 18:50,1,1,2,user,statement,50,1,1,none,,,Club thing is we're going to x 3 since since since to 2 times 3 equals 6 then 12 with double that up and we'll reach
1072,5_080817,8/8/2017 18:50,1,1,2,nico,,,,,,1,no answer,Do we divide by TWO?
1073,5_080817,8/8/2017 18:50,1,1,2,user,statement,50,1,1,none,,,no
1074,5_080817,8/8/2017 18:50,1,1,2,nico,,,,,,1,no answer,Okay. I'm going to divide the six by two to get three. So that's what we do with the two and then what do we do?
1075,5_080817,8/8/2017 18:51,1,1,2,user,statement,50,1,1,none,,,well since the surface area of your legs were 12 how much do you think the surface area over torso will be since we covered up six fluid ounces of the paint and 12
1076,5_080817,8/8/2017 18:51,1,1,2,nico,,,,,,1,no answer,There is another six! Do we divide the six?
1077,5_080817,8/8/2017 18:51,1,1,2,user,statement,50,1,1,none,,,yes yes
1078,5_080817,8/8/2017 18:51,1,1,2,nico,,,,,,1,no answer,Okay. I'm going to divide the six by two to get three and then what?
1079,5_080817,8/8/2017 18:51,1,1,2,user,statement,50,1,1,none,,,and then
1080,5_080817,8/8/2017 18:51,1,1,2,nico,,,,,,1,no answer,That's very interesting. Can you explain that more?
1081,5_080817,8/8/2017 18:52,1,1,1,user,,50,0,1,step_2_1,,,
1082,5_080817,8/8/2017 18:52,1,1,1,nico,,,,,,1,no answer,That's very interesting. Can you explain that more?
1083,5_080817,8/8/2017 18:52,1,1,1,user,statement,50,1,1,none,,,okay Niko sense
1084,5_080817,8/8/2017 18:52,1,1,1,nico,,,,,,1,no answer,I'm still learning ratios. Maybe you can explain more?
1085,5_080817,8/8/2017 18:52,1,1,1,user,statement,50,1,1,none,,,okay Niko
1086,5_080817,8/8/2017 18:52,1,1,1,nico,,,,,,1,no answer,That sounds good. Then what do we do?
1087,5_080817,8/8/2017 18:53,1,1,1,user,statement,50,1,1,none,,,we are going to
1088,5_080817,8/8/2017 18:53,1,1,1,nico,,,,,,1,no answer,I'm sorry. I am trying. What do we do?
1089,5_080817,8/8/2017 18:53,1,1,1,user,statement,50,1,1,none,,,we're going to multiply 2 times 4 times 2 I mean since we multiplied 6 x 2 to get the surface area of your legs we're going to do the same thing with the fluid ounces of the paint we're going to be covering
1090,5_080817,8/8/2017 18:53,1,1,1,nico,,,,,,1,no answer,What do we multiply two by? Do you mean we multiply three by six?
1091,5_080817,8/8/2017 18:53,1,1,1,user,statement,50,1,1,none,,,no we multiply 2 by 2
1092,5_080817,8/8/2017 18:53,1,1,1,nico,,,,,,1,no answer,What do we multiply two by? Do you mean we multiply three by six?
1093,5_080817,8/8/2017 18:53,1,1,1,user,statement,50,1,1,none,,,we are going to multiply two by two
1094,5_080817,8/8/2017 18:53,1,1,1,nico,,,,,,1,no answer,What do we multiply two by? Do you mean we multiply three by six?
1095,5_080817,8/8/2017 18:54,1,1,1,user,statement,50,1,1,none,,,no
1096,5_080817,8/8/2017 18:54,1,1,1,nico,,,,,,1,no answer,That's very interesting. Can you explain that more?
1097,5_080817,8/8/2017 18:54,1,1,1,user,statement,50,1,1,none,,,so we're basically going to do is multiply 2 by 2
1098,5_080817,8/8/2017 18:54,1,1,1,nico,,,,,,1,no answer,What do we multiply two by? Do you mean we multiply three by six?
1099,5_080817,8/8/2017 18:54,1,1,2,user,,50,0,1,step_1_2,,,
1100,5_080817,8/8/2017 18:54,1,1,2,nico,,,,,,1,no answer,I'm really not sure what to do on STEP TWO.
1101,5_080817,8/8/2017 18:54,1,1,1,user,,50,0,1,step_2_1,,,
1102,5_080817,8/8/2017 18:54,1,1,1,nico,,,,,,1,no answer,I'm actually not sure what you said. Try saying it again but differently?
1103,5_080817,8/8/2017 18:55,1,1,1,user,statement,50,1,1,none,,,we're going to be multiplying to fluid ounces by 2 because we did the same thing with the 6 squared inches of your feet by 2 which God is 12 so we're going to do to fluid ounces x 2
1104,5_080817,8/8/2017 18:55,1,1,1,nico,,,,,,1,no answer,Do we divide by TWO?
1105,5_080817,8/8/2017 18:55,1,1,1,user,statement,50,1,1,none,,,no
1106,5_080817,8/8/2017 18:55,1,1,1,nico,,,,,,1,no answer,I may be a robot but I do try hard. Can you explain more?
1107,5_080817,8/8/2017 18:55,1,1,1,user,statement,50,1,1,none,,,so we're basically going to do is multiply 2 by 2 which would get us
1108,5_080817,8/8/2017 18:55,1,1,1,nico,,,,,,1,no answer,Oh okay. We multiply! We multiply two times two?
1109,5_080817,8/8/2017 18:55,1,1,1,user,statement,50,1,1,none,,,yes
1110,5_080817,8/8/2017 18:55,1,1,1,nico,,,,,,1,no answer,So that's four. Then we have the answer is four?
1111,5_080817,8/8/2017 18:55,1,1,1,user,statement,50,1,1,none,,,yes
1112,5_080817,8/8/2017 18:55,1,1,1,nico,,,,,,1,answering,I will put the answer is four.
1113,5_080817,8/8/2017 18:55,1,1,1,user,statement,50,1,33,none,,,good job
1114,5_080817,8/8/2017 18:55,1,1,1,nico,,,,,,1,no answer,Thank you. You're a great tutor.
1115,5_080817,8/8/2017 18:55,1,1,2,user,,50,0,33,step_1_2,,,
1116,5_080817,8/8/2017 18:55,1,1,2,nico,,,,,,1,no answer,I'm really not sure what to do on STEP TWO.
1117,5_080817,8/8/2017 18:56,1,1,2,user,statement,50,1,33,none,,,don't worry I'll help you
1118,5_080817,8/8/2017 18:56,1,1,2,nico,,,,,,1,no answer,I tend to meander a bit. Can you repeat that?
1119,5_080817,8/8/2017 18:56,1,1,2,user,statement,50,1,33,none,,,Sony Co what it what is 2 times what equals 6
1120,5_080817,8/8/2017 18:56,1,1,2,nico,,,,,,1,no answer,Do we divide by TWO?
1121,5_080817,8/8/2017 18:56,1,1,2,user,statement,50,1,33,none,,,no
1122,5_080817,8/8/2017 18:56,1,1,2,nico,,,,,,1,no answer,Okay. I'm going to divide the six by two to get three. So that's what we do with the two and then what do we do?
1123,5_080817,8/8/2017 18:57,1,1,2,user,statement,50,1,33,none,,,no Neko
1124,5_080817,8/8/2017 18:57,1,1,2,nico,,,,,,1,no answer,I tend to meander a bit. Can you repeat that?
1125,5_080817,8/8/2017 18:57,1,1,2,user,statement,50,1,33,none,,,so we're going to multiply 2 X 3 which equals what
1126,5_080817,8/8/2017 18:57,1,1,2,nico,,,,,,1,no answer,What do we multiply two by? Do you mean we multiply three by six?
1127,5_080817,8/8/2017 18:57,1,1,2,user,statement,50,1,33,none,,,Destiny Co
1128,5_080817,8/8/2017 18:57,1,1,2,nico,,,,,,1,no answer,This is a hard problem. What do we do next?
1129,5_080817,8/8/2017 18:57,1,1,2,user,statement,50,1,33,none,,,we are going to multiply
1130,5_080817,8/8/2017 18:57,1,1,2,nico,,,,,,1,no answer,I'm still learning ratios. Maybe you can explain more?
1131,5_080817,8/8/2017 18:58,1,1,2,user,statement,50,1,33,none,,,so where we going to be doing is multiplying 6 by 3 since that's what we got for fluid ounces we're going to multiply by 3 to get the answer for the square inches of your torso
1132,5_080817,8/8/2017 18:58,1,1,2,nico,,,,,,1,no answer,There is a six in this step two. What do we do with the number six here?
1133,5_080817,8/8/2017 18:58,1,1,2,user,statement,50,1,33,none,,,you're going to * 3
1134,5_080817,8/8/2017 18:58,1,1,2,nico,,,,,,1,no answer,I'm actually not sure what you said. Try saying it again but differently?
1135,5_080817,8/8/2017 18:58,1,1,2,user,statement,50,1,33,none,,,we are going to x 3
1136,5_080817,8/8/2017 18:58,1,1,2,nico,,,,,,1,no answer,I may be a robot but I do try hard. Can you explain more?
1137,5_080817,8/8/2017 18:59,1,1,2,user,statement,50,1,33,none,,,so the reason we're going to be multiplying by 3 4 6 is because two times 3 equals 6 and that's that's the answer for fluid ounces and then to find the square inches of your torso in a multiply three because that's how much we would multiply because 4 * 3 + 12 * 3 + 606 * 3 equals what
1138,5_080817,8/8/2017 18:59,1,1,2,nico,,,,,,1,no answer,There is another six! Do we divide the six?
1139,5_080817,8/8/2017 18:59,1,1,2,user,statement,50,1,33,none,,,no
1140,5_080817,8/8/2017 18:59,1,1,2,nico,,,,,,1,no answer,Oh okay. So that's what we do with the six and then what do we do?
1141,5_080817,8/8/2017 18:59,1,1,2,user,statement,50,1,33,none,,,we do not divide 6
1142,5_080817,8/8/2017 18:59,1,1,2,nico,,,,,,1,answering,So I will put the answer is eighteen.
1143,5_080817,8/8/2017 18:59,1,2,2,user,,50,0,49,problem_1_2,,,
1144,5_080817,8/8/2017 18:59,1,2,2,nico,,,,,,1,no answer,So I will put the answer is eighteen.
1145,5_080817,8/8/2017 19:01,1,2,1,user,statement,50,1,1,none,,,okay me go for this
1146,5_080817,8/8/2017 19:01,1,2,1,nico,,,,,,1,no answer,Figuring out the solutions to these problems is challenging for me but you're really helpful.
1147,5_080817,8/8/2017 19:01,1,2,1,user,statement,50,1,1,none,,,Sonoco for this problem we're going to be doing 6 since we got three for your three squared inches for your arms we're going to divide 6 by 6 by 2 and divide that by 2 and then we going to get we're going to get 3
1148,5_080817,8/8/2017 19:01,1,2,1,nico,,,,,,1,no answer,What do we do with the number six?
1149,5_080817,8/8/2017 19:01,1,2,1,user,statement,50,1,1,none,,,we divided by 2
1150,5_080817,8/8/2017 19:01,1,2,1,nico,,,,,,1,no answer,What do we do with the number TWO?
1151,5_080817,8/8/2017 19:01,1,2,1,user,statement,50,1,1,none,,,divided by 2
1152,5_080817,8/8/2017 19:01,1,2,1,nico,,,,,,1,no answer,What do we do with the number TWO?
1153,5_080817,8/8/2017 19:01,1,2,1,user,statement,50,1,1,none,,,we are going to divide the number two by two
1154,5_080817,8/8/2017 19:01,1,2,1,nico,,,,,,1,no answer,Oh okay. We divide! We divide six by two. That gives us two. We divide two by two?
1155,5_080817,8/8/2017 19:02,1,2,1,user,statement,50,1,1,none,,,we are going to divide 2 by 2 which is going to give us what answer
1156,5_080817,8/8/2017 19:02,1,2,1,nico,,,,,,1,no answer,What do we do with the number TWO?
1157,5_080817,8/8/2017 19:02,1,2,1,user,statement,50,1,1,none,,,we're going to ride number the number 2 with
